tweet,target,,,,,,,,,,
کیری تمہاری اس ویڈیو میں تمہارا پاجامہ پھٹا ہوا ہے,0,,,,,,,,,,
کیری تو سب سے اچھا ہے اور اس میں کوئی شک نہں,0,,,,,,,,,,
کیری تیرے پاس کم دھوئیں والی گاڑی ہے,0,,,,,,,,,,
کیری تیرے ہاتھ چلتے ہیں جب ممی بلاتی ہیں,0,,,,,,,,,,
کیری تیری ویڈیوز بہت کمال کی ہیں لیکن تیرے بات کرنے کا طریقہ انتا اچھا کیسے ہے پلیز جواب لازمی دیں,0,,,,,,,,,,
کیری دنچک پوجا,0,,,,,,,,,,
کیری دنچک پوجا کا نئی ویڈیو آیا ہے سیلفی مہربانی کر کے پوجا کے سیلفی گانے پر ویڈیو بناؤ,0,,,,,,,,,,
کیری سال بہت تم بہت کم ویڈیو بنائے گا میری پیشین گوئی ہے یہ,0,,,,,,,,,,
کیری سے بڑا چوتیا تو پیدا ہی نہں ہوا کوئی جو کتوں کی طرح سبسکرائبرز مانگ رہا ہے,1,,,,,,,,,,
کیری شریک پوپ کے اوپر بھی,0,,,,,,,,,,
کیری فاطمہ کنچ والا ویڈیو بناؤ پلیز,0,,,,,,,,,,
کیری کا سب سے اچھا شو,0,,,,,,,,,,
کیری کپل شرما کے شو پر کب آئے گا تو,0,,,,,,,,,,
کیری کوئی الفاظ نہیں آپ کے لیے پیار ہے بہت بہت گجرات سے,0,,,,,,,,,,
کیری کی کاپی ہے تو,0,,,,,,,,,,
کیری لویومیں پاکستان سے ہوں اور وقار ذکاء کو نہ دیکھا دیں,0,,,,,,,,,,
کیری مجھے تجھ سے پیار ہے بچے,0,,,,,,,,,,
کیری مناتی بہت اچھی ویڈیو اور پلیز بتا دو کہ تم اپنی ویڈیوز کو کس سافٹ وئیر سے ایڈٹ کرتی ہو,0,,,,,,,,,,
کیری مناتی بھائی میں سب سے تمہارا بڑا فائن ہوں پر ایک بات ہے کہ تو پہلے والی لوک میں ہی خوبصورت لگتا ہے,0,,,,,,,,,,
کیری مناتی بی بی سے بہتر ہے,0,,,,,,,,,,
کیری مناتی پلیز ناڈی خان کو بھی روسٹ کریں,0,,,,,,,,,,
کیری مناتی تمہاری آواز بہت سندر ہے,0,,,,,,,,,,
کیری مناتی کی اچھی ویڈیو ہے,0,,,,,,,,,,
کیری مناتی کی مناتی محفوظ کیسے ہو گیا پیچھے کا کیا ہوا,0,,,,,,,,,,
کیری مہربانی کرکے سالیان بھائیوں پر بھی ویڈیو بناؤ بہت مزہ آئی مہربانی کر کے ویڈیو بناؤ,0,,,,,,,,,,
کیری میری ویڈیو کی بھی بے عزتی کر دو,0,,,,,,,,,,
کیری یار اتنا عرصہ ہو گیا کوئی ویڈیو اپ لوڈ نہیں کیں,0,,,,,,,,,,
کیری یار بہت رامی,0,,,,,,,,,,
کیری یار تمہارا ڈانس بہت اچھا تھا اب ہر ویڈیو میں موہت سے ڈانس کروانا ضروری ہوتا ہے,0,,,,,,,,,,
کیری یہ تو پکا عمر کا پابند ہو گا بہن چود,0,,,,,,,,,,
کیسے ہو کیری بھائی ایک بار بات کرلو بھائی,0,,,,,,,,,,
کیوں اس کی خوشی میں اس کی گانڈ چاٹے گا,1,,,,,,,,,,
کیوں بھائی,0,,,,,,,,,,
کیوں بھائی پڑی ہوئی لکڑی گانڈ میں ڈال رہے ہو,1,,,,,,,,,,
کیوں بھائی رنڈی کیسی ہے وہ,1,,,,,,,,,,
کیوں سلمان اس کو کچھ آفر کروں گا,0,,,,,,,,,,
گاڈ آف وار تو کمپلیٹ کر بھائی,0,,,,,,,,,,
گار صیح گندی کی اس کی آپ سب نے مل کر بھوسڑی کا کنجر,1,,,,,,,,,,
گالی گالی میں ہلا ہے ادریس دلا ہے چار چوانی گوڈے پے فراگی دکی کے لوڑے پہ,1,,,,,,,,,,
گالیاں دینا انڈیا میں ایک عام سی بات ہے,0,,,,,,,,,,
گانڈ پھاڑ بہن چود ایک نمبر,1,,,,,,,,,,
گانڈ پھاڑ دی دکی بھائی,1,,,,,,,,,,
گانڈ پھاڑ دی میں آپ کے ساتھ ہوں بھائی انڈیا سے,1,,,,,,,,,,
گانڈ پھٹٰی کا گانڈو یہ ہرتیک روشن کے کھبے ٹٹے کی پیدائش ہے یہ,1,,,,,,,,,,
گانڈ پھٹ گئی شام کی اور نیا ویڈیو آگیا پلیز معاف کردو یار,1,,,,,,,,,,
گانڈ کا علاج ہے گانڈو کا نہں,1,,,,,,,,,,
گانڈ کے بال جلا دیے شام نے,1,,,,,,,,,,
گانڈ مار دی بھائی ایک نمبر,1,,,,,,,,,,
گانڈ مار دی تم نے کیری کی,1,,,,,,,,,,
گانڈ مارو اس کی اپنا لن اسکی گانڈ میں ڈال کتی کے بچے کی گانڈ پھاڑ دے,1,,,,,,,,,,
گانڈ مارو سالے کی چوتیا,1,,,,,,,,,,
گانڈ میں آگ لگ گئی ہو گی ان دونوں کی,1,,,,,,,,,,
گانڈ میں ڈالنا ہے منہ سے نکالنا ہے سب سے مزاحیہ جملہ,1,,,,,,,,,,
گانڈ ہی مار دی دونوں کی,1,,,,,,,,,,
گانڈ ہی مار لو بہن چود کی,1,,,,,,,,,,
گانڈو تو اپنے گریبان میں جھانک پہلے,1,,,,,,,,,,
گانڈو چبل لوگ ہیں یہ دونوں عجیب بہن چھولی چلائی ہے یوٹیوب پر,1,,,,,,,,,,
گانڈو شام ادریس,1,,,,,,,,,,
گانڈو کا بچہ شام ,1,,,,,,,,,,
گانڈو کیوں مجھے نکال دیا,1,,,,,,,,,,
گانڈو نے اپنی فیس بک پیج پر کمنٹس بند کیے ہوئے ہیں,1,,,,,,,,,,
گانڈو ہے شام ادریس,1,,,,,,,,,,
گدی پر تھپڑ واہ بھائی واہ,0,,,,,,,,,,
گراگی تیری پھدی میں لن ماروں جب سے تمہں دیکھا ہے ہر روز مٹھ لگ جاتی ہے,1,,,,,,,,,,
گراگی کی میں گانڈ میں لن ماروں بہت بہت مزہ آئے گا,1,,,,,,,,,,
گروہ چوہدری تم گھر میں بھی ایسے ہی بات کرتے ہو,0,,,,,,,,,,
گروہ کیری مہاراج کی جے,0,,,,,,,,,,
گلشن بھیا کو بھی ویڈیو میں لے آیا کر,0,,,,,,,,,,
گلی گلی میں شور ہے سیٹھی دلا چور ہے,1,,,,,,,,,,
گندے لڑکے یہ کوئی پیدائیشی نہں تھا,0,,,,,,,,,,
گھر پر تمہارا عاشق کھڑا ہے,0,,,,,,,,,,
گورے گورے گال تیری چھاتی پر,0,,,,,,,,,,
گیا وہ گانڈو اب وہ نہں آئے گا,1,,,,,,,,,,
گیتا کا حققی ورژن بہت اچھا تھا,0,,,,,,,,,,
گیتا والے گانے میں میں حیران کو کون سا گانا چلایا ہے جو بالکل کردار کے ساتھ میچ ہو رہا تھا,0,,,,,,,,,,
گیم پلے دیکھانا شروع کریں کیوںکہ یہ بہت دلچسپ ہے,0,,,,,,,,,,
گیم پلے کون سی گیم کا ہے,0,,,,,,,,,,
گیم کون سی ہے یہ,0,,,,,,,,,,
گیمنگ والی ویڈیو کر کیری کبھی کبھی,0,,,,,,,,,,
لاکھوں اور لاکھوں کمنٹس,0,,,,,,,,,,
لاکھوں لائیکس بھی ہیں بھائی,0,,,,,,,,,,
لاکھوں لائیکس ٹک ٹاک کےچھکے,0,,,,,,,,,,
لاکھوں ہونے والے ہیں بھائی کے مبارک ہو ابھی سے آپ کو,0,,,,,,,,,,
لاکھوں ویورز اور لائیکس آپ کے لیے کیا چوتیاپا ہے,1,,,,,,,,,,
لائیکس کچھ اوقات سے زیادہ ہیں,0,,,,,,,,,,
لب اس بار آپ کی ویڈیوز نے تو شام ادریس کی گانڈ پھاڑ دی ہے,1,,,,,,,,,,
لبیب تو چوتیا ہے یہ لڑکی نہیں ہے لڑکا ہے,1,,,,,,,,,,
لڑکے سخت ہو گیا یہ تو اس مادر چود کو نیند نہیں آنی پوری زندگی اس سالے کو,1,,,,,,,,,,
لڑکے لیول کر دیا تو نے اسی گندی کی کہ کسی کی ہوتی نہیں دیکھی تم نے اس گانڈو کو کھول کے رکھ دیا,1,,,,,,,,,,
لڑکیوں اور لڑکوں میرے چینل کو پسند کریں میں جلد اس پر ویڈیوز ڈالوں گا,0,,,,,,,,,,
لعنت ایسی رنڈی پر,1,,,,,,,,,,
لعنت ہے شام تم پر چوتیا,1,,,,,,,,,,
لگتا ہے اب ان کی گانڈ اتنی پھٹ چکی ہے کہ یہ سالا اب پاکستان ہی نہں آرہا,1,,,,,,,,,,
لگتا ہے تیرے کو برنال کی ضرورت ہے پہلے تیری گانڈ میں لنڈ گھوساؤں گا اور پھر برنال لگاؤں گا کتے کے بچے,1,,,,,,,,,,
لن سے بڑا کچھ نہیں ہے,1,,,,,,,,,,
لو ابھی دکی بھائی باقی ہےفراگی شادی کر لے صیح چوتیاپا ہے,1,,,,,,,,,,
لو تمہارے لیے ایک ویڈیو ڈیڈیکیٹ کیا ہے,0,,,,,,,,,,
لو یو بہت اچھا لگا بہن چود زبردست,1,,,,,,,,,,
لو یو بھائی اس بھڑوے کے ساتھ یہی ہونا چاہیے تھا,1,,,,,,,,,,
لو یو بھائی بہت مزے کی ویڈیو بنائی آپ نےبہت اچھا چوتڑ کوٹا ہے اس کا,1,,,,,,,,,,
لو یو بھائی زبردست بہن چود کی صیح گانڈ ماری ہے اس کتے نے,1,,,,,,,,,,
لو یو بھائی میں تو ان بہن چودوں کے ایک سال سے مخالف ہوں,1,,,,,,,,,,
لو یو حجاب انڈیا سے اور یہ شام چوتیا بکواس ویڈیوز بناتا ہے,1,,,,,,,,,,
لو یو کیری بھائی ہمارے لاکھ سبسکرائبرز پورے ہونے والے ہیں,0,,,,,,,,,,
لو یو میری جان یہ بندہ ہے ہی بھوسڑی کا دلا اور بیوقوف آپ پریشان نہ ہوں,1,,,,,,,,,,
لوڑا کھا میرا,1,,,,,,,,,,
لوڑا ہا ہا ہا ہا,1,,,,,,,,,,
لوڑو لوڑو یدھو لوڑو,1,,,,,,,,,,
لوڑے تمہیں پاکستان کی فیفا رینکنگ پتہ ہے آگیا سالا فٹ بال کھیلنے,1,,,,,,,,,,
لوڑے تیری ویڈیو لوڑا دیتا نہیں,1,,,,,,,,,,
لوڑے لگ گئے سب ,1,,,,,,,,,,
لوڑے لگ گئے شام ادریس کے بھائی بالکل ٹھیک بات اور بہت بڑا دلا ہے سالا,1,,,,,,,,,,
لوڑے لگا دئیے تم نے بھوسڑی کے کو لو یو,1,,,,,,,,,,
لوگ اس کی ویڈیو کو بھی ناپسند کر رہے ہیں سچی میں چوتیا ہے یہ,1,,,,,,,,,,
لوگوں نے اس ویڈیو کو ناپسند کیا ہے یہ وہی ہے جن کی گانڈ پر کوڑے مارے گیئے تھے,1,,,,,,,,,,
لویو حجاب دکی بھائی گانڈ مارو اس سالے کی,1,,,,,,,,,,
لے بھائی اس پر ویڈیو بنا اور کھول کر داد وصول کر,0,,,,,,,,,,
لیکن ابھی بھی تم سے پیار کرتا ہوں,0,,,,,,,,,,
لیکن اپنی موٹر سائیکل کتنے میں بیچی,0,,,,,,,,,,
لیکن اچھا کام ہے آپ کا میں آپ کی تعریف کرتا ہوں,0,,,,,,,,,,
لیکن اس طرف کوئی رجحان نہیں ہے,0,,,,,,,,,,
لیکن اس کا اصل نام فراڈی ہے,0,,,,,,,,,,
لیکن اس کا لنڈ بہت بڑا ہے آؤ نا کبھی حویلی پر,0,,,,,,,,,,
لیکن اسلام تشدد نہیں سکھاتا,0,,,,,,,,,,
لیکن ان کی بغیرت اور چت قسم کی ویڈیوز نے مجھے پاگل بنا دیا,1,,,,,,,,,,
لیکن آپ بابوسر تو نہیں گیئے,0,,,,,,,,,,
لیکن بھائی یہ آخر میں کیا تھا اس کی تو شکل ہی چھڈو ہے سالے کی,1,,,,,,,,,,
لیکن تم ایک چوتیے ہو,1,,,,,,,,,,
لیکن چوتیا ہے کون,1,,,,,,,,,,
لیکن حادثہ والا چکر نہیں بتایا کتے,1,,,,,,,,,,
لیکن دکان والے نے کہا کہ سالے منہ مع لوڑا پھینک کر ماروں گا نکل میری دکان سے,0,,,,,,,,,,
لیکن دوسروں سے بری باتیں کر رہا ہے,0,,,,,,,,,,
لیکن کیوں اتنی گندی زبان کوئی ڈر نہیں,0,,,,,,,,,,
لیکن مسلم عورتوں کو ہی ضروری نہیں کہ وہ نقاب کریں,0,,,,,,,,,,
لیکن میں اب بہت خوش ہوں,0,,,,,,,,,,
لیکن میں ایک بہت اچھی بہوں ہوں,0,,,,,,,,,,
لیکن میں پسند نہیں کرتا,0,,,,,,,,,,
لیکن میں کہوں گا کہ دونوں گانڈ مرواؤ بہن چودی کی بھی کوئی حد ھوتی ہے,1,,,,,,,,,,
لیکن میں نے بی بی کا میوزک سنا ہے لیکن اس کو پہلے ایڈ کرو,0,,,,,,,,,,
لیکن ہم پیار کرتے ہیں عرفان بھائی,0,,,,,,,,,,
لیکن یہ دیپک کا لڑکا زیادہ بے عزتی نہیں کر رہا ہے,1,,,,,,,,,,
لینے کا کیا پلان ہے,0,,,,,,,,,,
مادر چود تیری گانڈ میں بمبو ڈالے گا بہن چود,1,,,,,,,,,,
مادر چود سالا پاکستان,1,,,,,,,,,,
مادر چود شام لونڈا فراگی تیری گانڈ میں گھوڑے کا لوڑا,1,,,,,,,,,,
مادر چود کیسے ڈسلائیک مار رہے ہو دکی بھائی کو نبڑو ویڈیو ٹھیک سے دیکھو,1,,,,,,,,,,
مادر چود ہے شام سالا لو یو دکی بھائی,1,,,,,,,,,,
مادرچود ادریس,1,,,,,,,,,,
مادرچود خود ہے زیادہ نہں ہو سکتا تو شام کو بدنام ہی کر کے دیکھ لیں,1,,,,,,,,,,
مادرچود مار اس شام کی,1,,,,,,,,,,
مادرچود وہ آئرن مین نہں ہے وہ بیٹ میں ہے,1,,,,,,,,,,
مار جاتے ہیں بہن کے لوڑے,1,,,,,,,,,,
ماریہ باجی آپ کو کچھ نہیں پتہ آپ بس گانا سنا کرو دکی کے بارے میں کوئی غلط بات نہں,1,,,,,,,,,,
ماں چود اس بھوسڑی کے والے کی,1,,,,,,,,,,
ماں چود اندھے کی آنکھ کول نہ کہ دھندے کی,1,,,,,,,,,,
ماں چود دو اس کی,1,,,,,,,,,,
ماں چود دی اس کی,1,,,,,,,,,,
ماں چود دی بھائی اس بھوسڑی کے کی تم نے ,1,,,,,,,,,,
ماں چود دی تو نے تو اس کی,1,,,,,,,,,,
ماں چود دی دکی بھائی لو یو انڈیا سے,1,,,,,,,,,,
ماں چود دیں گے اس کی اگر غلطی سے بھی برے کمنٹس کرنے کی کوشش کی تو,1,,,,,,,,,,
ماں چود کر رکھ دی آج تو ان سالوں کی,1,,,,,,,,,,
ماں چودو اس کی ہم آپ کے ساتھ ہیں,1,,,,,,,,,,
ماں کی چوت کو بند کرو کمینے تم ادریس کے چینل کو بند کرواؤ گے,1,,,,,,,,,,
ماں کی گانڈ لنگڑے کی,1,,,,,,,,,,
مبارک کو کیری آئی لو یو,0,,,,,,,,,,
مبارک ہو بھائی ایسی والی ہی چاہیے,0,,,,,,,,,,
مبارک ہو بھائی لاکھوں ویورز کے لیئے,0,,,,,,,,,,
مبارک ہو مجھے سبسکرائب کرو,0,,,,,,,,,,
مجھے ابھی تک سمجھ نہں آئی کہ کیری کو لاکھوں سبسکرائبرز کیسے مل گئے کون چوتیا لوگ ہیں جو اس کو سبسکرائب کرتے ہیں,1,,,,,,,,,,
مجھے اس کا موضوع بہت پسند ہے,0,,,,,,,,,,
مجھے ایسا ہی تو لگتا ہے,0,,,,,,,,,,
مجھے بتائیں کہ کس نے کیری کو لائیک کیا ہے,0,,,,,,,,,,
مجھے بمبئی میں جانا تھا پر میں بممبئی میں ہی رہ رہا تھا,0,,,,,,,,,,
مجھے بھی اپنا لوڑا گورا کرنا ہے مجھے بھی اپنی کریم دےدے اس کی شکل سے تو اچھا میرا لوڑا ہے,1,,,,,,,,,,
مجھے بھی ہمیشہ زندہ رہنے والی بوٹی دے دو شکریہ,0,,,,,,,,,,
مجھے پہلے سے ہی اس پر چوتیا پر غصہ آتا تھا آج دکی بھائی نے اس کو اور کھول کر رکھ دیا,1,,,,,,,,,,
مجھے تم پر فخر ہے بھائی,0,,,,,,,,,,
مجھے تو شروع سے ہی شام رنڈی نہں پسند,1,,,,,,,,,,
مجھے سٹار بوائے کا گانا بہت پسند آیا بہت اچھا کام تھا کیری,0,,,,,,,,,,
مجھے سمجھ نہیں آتا کہ کون بڑا چوتیا نا پسند کی بٹن کو کلک کرتا ہے,1,,,,,,,,,,
مجھے کالج جانا پسند نہیں ہے,0,,,,,,,,,,
مجھے کسی بھی وجہ سے سبسکرائبر چاہیئں,0,,,,,,,,,,
مجھے لاکھوں سبسکرائبر چاہیں مہربانی فرمائیں,0,,,,,,,,,,
مجھے لگا تو نے کہا ہے پھنس گیا تھا پھر دوبارہ دیکھا,0,,,,,,,,,,
مجھے نہں پتا پر چوتیا وہ نہں چوتیا وہ لوگ ہیں جو اس کی ویڈیوز دیکھتے ہیں,1,,,,,,,,,,
مجھے یہ ٹون اور میوزک بہت پسند ہے,0,,,,,,,,,,
مجھے یہ کہتے ہوئے شرم آرھی ہے کہ میں آسام سے ہوں,0,,,,,,,,,,
محترم حجاب بھائی صیح بجائی تم نے اس چوتیا کی میں تم کو اس کی داد دیتا ہوں,1,,,,,,,,,,
مذہب کے نام پر جب یہ چوتیاپا رہنا تب تک انڈیا پاکستان اور برصغیر کی حالت نہں بدل سکتی,1,,,,,,,,,,
مرے کمنٹ کو سب سے زیادہ لائیکس کرنے کا شکریہ,0,,,,,,,,,,
مری مدد کرنا پلیز میں ایک سافٹ وئیر چلا رہا ہوں لیکن اس کے لیے بٹ چاہیے اور میرے پاس بٹ نہں ہے کیا میں کیسے چل سکتا ہوں,0,,,,,,,,,,
مزہ آگیا بھائی اس میں جو گیم ہے اس کا نام کیا ہے,0,,,,,,,,,,
مزہ آگیا بھائی مگر یہ شکل اور عقل سے بھی چوتیا ہے,1,,,,,,,,,,
مزہ آگیا بھائی میری دعا ہے کی تم ہمیں اسی طرح محظوظ کرنے میں کامیاب رہو,0,,,,,,,,,,
مزہ آگیا تم ویڈیو بنانے میں مست ہو وہ سیکس کو ملانے ولا سین بہت اچھا تھا,0,,,,,,,,,,
مزہ آگیا کیری بھائی,0,,,,,,,,,,
مس وہ گیم پلے کی ویڈیو فیس کیم سے زیادہ پسند آیا,0,,,,,,,,,,
مست بھائی چھا گئے,0,,,,,,,,,,
مست ہے دکی بھائی شام کی گانڈ جلتےہوئے دیکھنے میں مزہ آیا بہت,1,,,,,,,,,,
مست ویڈیو ہے بھائی,0,,,,,,,,,,
مست ویڈیو ہے بھائی پہلے ولا بغیر شکل کے بنایا اس بار,0,,,,,,,,,,
مسٹر لوتھا ٹھیک ہے بھائی تم کرو,0,,,,,,,,,,
مسکان کالرہ پر کوئی ویڈیو بناؤیار,0,,,,,,,,,,
مسلمان کے شر سے مسلمان بچے رہیں اور غیر مسلم کی گانڈ مار دو,1,,,,,,,,,,
مشرہ جی تو توپ نکلے,0,,,,,,,,,,
مشرہ جی سب سے اچھا بہاری کریکٹر کر رہا ہے مجھے بہت پسند آیا,0,,,,,,,,,,
مشرہ جی کے لیے لائیک کرو یارو,0,,,,,,,,,,
مشرہ جی نے سب سے زیادہ کھیل کھیلا ہے,0,,,,,,,,,,
مشہور لوگوں کا ڈانس اور بیک گراؤنڈ میں میوزک,0,,,,,,,,,,
مطلب کچھ بھی فالتو میں چھیڑ سے چھیڑا لوگوں نے,0,,,,,,,,,,
معزز بھائی یہ چوتیا کبھی بھی کسی کو نہیں چھوڑے گا,1,,,,,,,,,,
معصومی ہا ہا ہا ہنس ہنس کے برا ہال ہو گیا بھائی کمال ہو گیا,0,,,,,,,,,,
ملائکہ پر ویڈیوز بنائیں,0,,,,,,,,,,
ممسئلوں کو حل کرنےوالا,0,,,,,,,,,,
ممی میرے ہیڈفون دیکھے ہیں کیا کیری مناتی,0,,,,,,,,,,
مناتی بھائی اترو میں ٹیکنیکل گروجی کو روسٹ کرنے لگا تھا کیا,0,,,,,,,,,,
مناتی بھائی گیم پر کب ویڈیو بنا رہا ہے تو,0,,,,,,,,,,
مناتی تم بہترین ہو سب سے اور وہ سموسہ مزے کا تھا,0,,,,,,,,,,
منٹ ہوا نہیں کہ کمنٹ آگئے,0,,,,,,,,,,
منٹوں میں لاکھوں دیکھنے والے واہ,0,,,,,,,,,,
منچلوں مہربانی کر کے آم چھی والے گانے پر بھی کچھ کہو,0,,,,,,,,,,
منچلے بالوں کی کٹنگ بہت بری ہے,0,,,,,,,,,,
منہ بند کروا دیا آپ نے اس سالے کا بہت بکواس کر رہا تھا آج کل وہ بہن چود,1,,,,,,,,,,
منوج سنگھ تیری ماں اور بہن کو رکھیل بنانے والے,0,,,,,,,,,,
مہربانی فرما کر ایک ویڈیو اس پوپی پر بھی بنائیں,0,,,,,,,,,,
مہربانی کر کے اپ میرے چینل کو سبسکرائب کریں پروان ٹیک,0,,,,,,,,,,
مہربانی کر کے اس بکواس پر بھی ایک ویڈیو بناؤ,0,,,,,,,,,,
مہربانی کر کے اکثر اپ لوڈ کیا کریں,0,,,,,,,,,,
مہربانی کر کے جھوٹی عورتوں پر ویڈیو بناؤ,0,,,,,,,,,,
مہربانی کر کے دنچک پوجا کا نیا گانا روسٹ کرو سیلفی لینے آجا,0,,,,,,,,,,
مہربانی کر کے فیس کیم بند کر کے گیم پلے پر دوبارہ آؤ,0,,,,,,,,,,
مہربانی کر کے مجھے سبسکرائب کریں اور میں بھی آپ کو سبسکرائب کروں گا,0,,,,,,,,,,
مہربانی کر کے ہماری مزاحیہ ویڈیو دیکھیں اور اگر اچھی لگے تو مہربانی کر کے رجسٹرہوں,0,,,,,,,,,,
مہربانی کرکے میرا چینل سبکرائب کریں میں مزاحیہ ویڈیوز کو اپ لوڈ کرتا ہوں,0,,,,,,,,,,
مہربانی کرکے میرا چینل کی ویڈیوز دیکھیں نہیں تو میں اس کو چھوڑ رہا ہوں,0,,,,,,,,,,
مہربانی کرو مجھے چاند پر نہں جانا ہے,0,,,,,,,,,,
مہربانی ہوگی مجھےآخری والا پورا گانا چاہیے,0,,,,,,,,,,
موہت مناتی بھی ہے,0,,,,,,,,,,
موہت نام لے رہا تھا بندہ تو کچھ تو منطق ہوگی کوئی دوست ہوگا موہت نام کا وغیرہ وغیرہ,0,,,,,,,,,,
میاں خلیفہ کی طرح دیکھا رہا ہے تولیکن جو بھی ہے میرا بہت پسندیدہ ہے تو,0,,,,,,,,,,
میر عامر بھائی یہ بہت سخت ہے,0,,,,,,,,,,
میرا اطلاعات کا وزیر کدہر ہے,0,,,,,,,,,,
میرا بہت پسندیدہ کیری,0,,,,,,,,,,
میرا تو بورڈ کا امتحان ہے اور تیاری تو بالکل بھی نہیں ہے,0,,,,,,,,,,
میرا خیال ہے کہ مجھے ویڈیوز دیکھنی چاہیے لیکن میں نے اب حادثاتی طور پر یہ ویڈیو دیکھی ہے,0,,,,,,,,,,
میرا خیال ہے کہ میں اپنی ساس کے ساتھ موم کی طرح سلوک کروں گی,0,,,,,,,,,,
میرا خیال ہے وہ جانتا ہے کہ وہ کتنے منٹ کی ویڈیو تھی,0,,,,,,,,,,
میرا دل چاہتا ہے شام کو ایک لوڑا ماروں اس کا خاندان پورا چود گیا,1,,,,,,,,,,
میرا دل کرتا ہے جب تک یہ یوٹیوب ہے میری تیری ساری ویڈٰیوز دیکھتا رہوں بہن چود آواز سن کر ہی ہنسی آجاتی ہے,1,,,,,,,,,,
میرہ خیال ہے یہ بندہ ٹھیک نہیں ہے,0,,,,,,,,,,
میرے بھائی تجھے تو خوش ہونا چاہئیے انتنی خوبصورت لڑکی تیرے ٹکڑوں پر زندہ ہے سالی تیرا نام لے کر بیرون ملک,1,,,,,,,,,,
میرے پسندیدہ حصہ کو شروع کریں,0,,,,,,,,,,
میرے چینل کا نام بھی اٹھا دوں یارنام ہے انڈین ٹھرکی چور,0,,,,,,,,,,
میرے ساتھ گھر میں مسلمان دوست رہتےہیں جو کہ غلط نہں ہے باقی دینا کے لیے وہ کمینے ہیں اگر میرا دوست کمینہ نہیں ہے تو باقی مسلمان کیوں کمینے ہو گئے,1,,,,,,,,,,
میرے شائقین لائیک بٹن کو دبائیں,0,,,,,,,,,,
میرے علاوہ کون کیری مناتی کی ویڈیوز کا انتظار کر رہا ہے,0,,,,,,,,,,
میرے لیول کا ویڈیو ہے,0,,,,,,,,,,
میری آرایس کی جوتی آپ کا انتظار کررہی ہے,0,,,,,,,,,,
میری خواہش ہے کہ میں اکیلا اس کو لاکھوں بار لائیکس کر سکوں,0,,,,,,,,,,
میری خواہش ہے کہ میں ایک سے زیادہ بار لائیک کر سکتا,0,,,,,,,,,,
میری سب سے آخری پسندیدہ انوپ جلوتا ہے,0,,,,,,,,,,
میری طرف سے ان کو بھی مبارک دے دینا کیری بھائی,0,,,,,,,,,,
میری ویڈیوز آپ سے بہتر ہیں میں اپنے آپ کو مارنے لگا ہوں,0,,,,,,,,,,
میں اب جب بھی کمپیوٹر پر گانے چلاتا ہوں تو مجھے یہ ویڈیو یاد آجاتی ہے,0,,,,,,,,,,
میں ابھی تک اسی کو دیکھ رہا ہوں,0,,,,,,,,,,
میں اس چوتیا کا انتظار کر رہا ہوں ویسے ویڈیو بہت اچھی تھی دکی بھائی,1,,,,,,,,,,
میں اس سے متفق ہوں کہ میں یہ لے لیتا ہوں یہ کہ کر کہ اس کی کیا ضرورت ہے,0,,,,,,,,,,
میں اس کی گندی والی بے عزتی چاہتی ہوں,1,,,,,,,,,,
میں اس کی ہر ویڈیو پر کمنٹ کرتا ہوں یہ ہے ہی چوتیا سالا بکواس کرتا ہے,1,,,,,,,,,,
میں اس ویڈیو کو کئی باردیکھ سکتا ہوں بہت دلچسپ اور مشرہ جی تو پکے بہاری لگ رہے ہیں,0,,,,,,,,,,
میں انڈیا سے ہوں اور سیٹھی چوتیا ہے سالا,1,,,,,,,,,,
میں ایسا سافٹ وئیر بنا رہا ہوں جو ان جیسے چوتیوں کے چینل بند کرے,1,,,,,,,,,,
میں آپ سے منتی پیار کرتا ہوں,0,,,,,,,,,,
میں آپ سےبھائی بہت متاثر ہوا ہوں اصل محنت تو آپ لوگ کرتے ہیں وہ تو صرف لوگوں کو چوتیا بنا رہا ہے,1,,,,,,,,,,
